Job Title,Job Description,Rating,Company Name,Location,Headquarters,Size,Founded,Industry,Sector,Revenue,Competitors
Data Scientist (m/f/d),"Proxygen harnesses the cellular protein quality control system to develop therapies against cancer and other life-threatening diseases. We are focused on particular small molecules called “molecular glue degraders” which mediate recruitment of a disease-causing protein to a ubiquitin ligase where it is ubiquitinated and directed to the proteasome for degradation. Hence, instead of merely blocking the function of harmful proteins, molecular glue degraders enable their complete and selective elimination.

Proxygen is located in the VBC6 Startup Labs, a new co-working space for biotech companies embedded in the Vienna Biocenter campus, one of Europe’s hotspots for life sciences. Within this context, Proxygen creates a vibrant, dynamic, and inclusive work environment with a strong emphasis on collaboration and teamwork.

We are looking for an enthusiastic full-time Data Scientist (f/m/d) excited to join our team.

What exactly we are looking for

PhD in computational biology, bioinformatics or in the life sciences – applicants with a master’s degree and 4+ years of relevant experience will also be considered
Proven scientific track record in the analysis of high-dimensional biological datasets, such as genomics, transcriptomics, and proteomics data (including at least one first author publication)
Extensive knowledge of programming languages such as Python and/or R, as well as bash scripting, familiarity with data visualization packages (matplotlib, seaborn, ggplot) is a plus
Solid background in statistics
Experience in machine learning algorithms, version control (Git) and database management are of advantage
Excellent organizational skills and attention for detail
Good written and oral communication skills in English are required
Positive attitude, reliability, professionalism, and team player mentality

What your main responsibilities will be

Design, implementation, and execution of analysis pipelines for proprietary and public omics datasets, with a focus on next-generation sequencing (CRISPR screens, transcriptomics) and proteomics data
Experimental design, statistical analysis, and interpretation of results in close collaboration with wet-lab scientists
Establishment and maintenance of internal data processing, analysis, and management framework
Internal training in data analysis
Accurate and meticulous recording of work processes and results according to internal documentation practices. Preparation of publication-quality visualizations of results and contribution to external communication and reporting

What we offer

International & multidisciplinary team of scientists consisting of molecular biologists, computational biologists, and chemists
Participation in cutting edge research with the overall goal to improve therapeutic options for cancer patients
Opportunity to contribute to one of the hottest fields in drug discovery
Support of professional development according to individual goals and aspirations
Competitive salary based on the applicant’s skills and experience
Access to state-of-the-art infrastructure
Progression into a team leader role

About Vienna

The Austrian capital has come out on top of “the world’s highest quality of living” rankings for the past ten years and recently won “the world’s greenest city” award in 2020. Reasons for Vienna’s prime positioning include:
Affordable high-quality housing, reliable and affordable public transport
International airport with non-stop flights to all major cities in Europe
First-class public healthcare and public educational system
Parks, recreational areas, and other green spaces constituting 50% of the urban area
Large variety of cultural facilities and leisure activities inside and outside the city
Young, international population & very high penetrance of English as a second language

The monthly minimum (gross) salary for this position amounts to €54.600 per year. Salary and conditions are commensurate to the experience of the candidate and can be negotiated.

Application details

Please submit your comprehensive application, including a detailed letter of motivation and curriculum vitae with contact details of two referees to hr@proxygen.com as a single PDF. Applications will be reviewed on a rolling basis until the position is filled.",-1,Proxygen,Gerasdorf bei Wien,-1,-1,-1,-1,-1,-1,-1
Data Scientist,"At Jabil, we empower the brands who empower the world – it’s our reason for being and the guiding force that’s driving us to become the most technologically advanced manufacturing solutions provider on the planet. Whether we’re serving one of the world’s biggest and best known brands or the coolest tech startups, our resolve never wavers. We share common desires with these brands: to make the world a better, safer and cleaner place.

JOB QUALIFICATIONS
KNOWLEDGE REQUIREMENTS

● Advanced Statistics, operations research/ management, mathematics or business analytics with experience, courses, or project work in an analytic methods such as linear, mixed linear, constraint programming, modeling, simulation, time series analysis, pattern recognition, queuing theory, multivariate analysis, and other various predictive analytics techniques

● Strong written and verbal communication skills and the ability to work effectively in teams and under pressure. Multi-lingual capability is a plus.

● Ability to draw conclusions from data and prescribe actionable and measurable activities.

● Highly motivated and creative, thinking “out of the box”.

● Familiarity with non-relational data frameworks (aka NoSQL, eg. Hive).

● Experience with Apache Pig, Spark systems.

● Strong team mentality, interpersonal and communications skills

● Preferred working directly with management and executives

Preferred experience:
Jupyter Notebook experience (e.g. Anaconda, DataBricks)
Coding in multiple languages: Python a must, but also familiarity with UI frameworks like for presentation layer: Angular/React.JS, Vue.js with Node.js
Alternatively, Plotly/Dash, ShinyApp or Bokeh - presentation frameworks for creating dashboards
Experience with No SQL database especially for document records: Elastic Search, MongoDB, Cosmos DB. Able to update records through programming and ability to query data in custom applications.
Statistics/Analytic capabilities (Anova, t-test, f-test, logging, Big-O notation, etc.)
Data modeling and model analysis; Data Science development; sci-kit learn and open CV, popular python libraries
Cloud computing (AWS, Azure or Google) - know how to use SDKs for data storage access and management through programming code and experience with cli tools. Able to create resources like blob storage, databases and virtual machines.
Software data structure understanding (stacks, hash tables, arrays, queues, trees, linked list) and code optimization knowledge.
CI/CD project development - Agile scrum style software development
Git versioning; know how to merge and commit changes to a branch. Not steps on others code.
Nice to have
Back-end languages like Java or C#
Shell scripting like bash, powershell, ansible or Chef
CI/CD Data Modeling automation, e.g. AWS SageMaker, AirFlow, Kubeflow, Azure ML or Google
Docker, Kubernetes; Use of yaml and dockerfiles files to build Docker containers (Helm Charts and kubectl)
Work location: Job can be performed remotely from Ukraine OR Hungary OR Poland

Jabil, including its subsidiaries, is an equal opportunity employer and considers qualified applicants for employment without regard to race, color, religion, national origin, sex, sexual orientation, gender identify, age, disability, genetic information, veteran status, or any other characteristic protected by law.",3.8,"Jabil
3.8",Heimarbeit,-1,10000+ Employees,1966,Manufacturing,Electrical & Electronic Manufacturing,$10+ billion (USD),-1
Senior Data Scientist (F/M),"ABOUT THE JOB

The Senior Data Scientist is responsible for leveraging internal and external data by applying data science (data mining, statistics, artificial intelligence) to discover insights, generate predictions and optimize processes.

Your tasks among others will be:
Liaising with stakeholders on the main descriptive, predictive and prescriptive analytics requirements and act as a consultant during the project definition phase.
Optimizing and enhancing the data science products that are currently in production, including testing the effectiveness and periodically monitor the performance.
Developing data science products ensuring business improvements are impactful and aligned to the company objectives and strategy, including appropriate and structured documentation of the methodology and data used.
Leading the design and delivery of AI and automation solutions.
Conceptualizing and supporting building data pipelines together with Data Engineers.
Presenting data science final products but also the background models and insights to a range of stakeholders to support strategic decisions.
Pro-actively identifying and communicating meaningful patterns from large data sets extracted from both internal and external data sources.
Creating visualization to discover and share insights.
Contributing in developing the Data & Analytics platform together with the Business Intelligence and the Data Engineering teams.
Handing over and operationalizing the data science products developed by the decentralized Data Science labs.
Supporting the development of the team by coaching peers, identifying partnership (universities, startups, etc.…) and attracting talents (by networking, communicating on data science at Swarovski) .
Developing (together with the Head of Data Science) the Data Science CoE operating model to enable the best collection requirements and operationalization for / of data science products.
ABOUT YOU

We are looking for a motivated talent, who brings along the following background:
min.8 years of professional experience in Data Science, Data Analytics, Business Intelligence and related fields.
Professional experience with statistical software (e.g., SAS, R, Python, Matlab) and database languages (e.g., MS SQL, T-SQL, Oracle, PL/SQL), any additional programming language is an asset.
Experience with big-data frameworks such as H2O, TensorFlow, Theano, Hadoop, Spark.
Well structured, analytical thinking and demonstrating the ability to explain and visualize complex analysis in a clear and understandable manner to a non-technical audience.
Ability to manage the full lifecycle of the data science products built.
Outstanding interpersonal communication and presentation skills.
Out of the box thinker, creative but also focused on continuous improvement.
Self-driven, flexible, open minded professional and proactive team player who ensures implementation towards agreed goals and timelines.
Takes ownership and proven track record of striving for excellence.
Fluency in English.
ABOUT SWAROVSKI

Swarovski is a family-run company, founded more than 120 years ago in Wattens, Austria. We are leading group of global companies committed to stable growth and maintaining our place at the forefront of design, creativity, and technological innovation.

Working for Swarovski is more than just a job. You will work for a groundbreaking, modern, premium brand, which is globally known for its quality and creativity. We place people at the heart of our business and offer global pay programs, supported by a range of local benefits. In addition, we provide rich development opportunities which recognize and reward the brilliant contributions of our passionate individuals and teams who contribute to the success of our company – sparkling every day.

As required by law, we advise that the collectively agreed base monthly salary for this position is set at a minimum of € 2.969,24 gross. Our actual salaries are market competitive and take individual qualifications and experience into account.

Are you passionate to contribute with enthusiasm to our success? Then we are looking forward to receiving your job application!",3.8,"Swarovski
3.8",Wattens,-1,10000+ Employees,1895,Retail,Beauty & Personal Accessories Stores,$2 to $5 billion (USD),-1
Data Analyst,"YOUR MISSION
As part of the Data Insights team you are empowering ready2order to become more data driven!
You will be involved in
Data Governance to ensure high quality data that other BI users can easily work with
Data Warehousing to maintain, expand and improve our single source of truth and its ETL processes
Business Intelligence where you provide Reports and Analysis and communicate your findings to stakeholders
Data Science - apply optimization models and predictive analytics to create sophisticated Data Insights
WITHIN 1 WEEK, YOU’LL
Complete the ready2order on-boarding bootcamp and learn about the company history, our business and where we are going.
Have coffee breaks with employees from different departments.
Meet your team.

WITHIN 1 MONTH, YOU’LL
Take a deep dive into our data, the infrastructure and our data governance processes.
Get to know our BI tool, best practices and company standards related to data insights.
Create your first ad-hoc reports and dashboards for key business stakeholders.

WITHIN 3 MONTHS, YOU’LL
Provide high quality data to other BI users by cleansing and transforming data within our BI tool using SQL.
Help establishing a Data Certification process.
Maintain descriptions for data and data related processes.

WITHIN 12 MONTHS, YOU’LL
Maintain and improve our ETL tool (Java).
Apply predictive analytics in BI reports.
Help building optimization models and tools.

SKILLS AND EXPERIENCES TO BE ready
You have a degree in Mathematics, Statistics, Computer Science, Software Engineering or similar field of study
You have +2 years of professional experience in data analytics/business intelligence or a related field.
You are an expert with SQL.
You have coding experience in Java, Python, R or another language.
You are familiar with ETL processes and data warehousing.
You have strong analytical, organizational and communication skills.
You are a motivated team player who can work independently.
You have very good oral and written communication skills in English. German language is an advantage.

Vision
Our vision is to become the top of mind standard for managing a small business. We create a central access to all essential tools, entrepreneurs really need to unleash the full potential of their business.",2.5,"ready2order GmbH
2.5",Wien,-1,51 to 200 Employees,-1,-1,-1,Less than $1 million (USD),-1
Senior Data Scientist,"Who We Are

MOSTLY AI is a Vienna, Austria based high-tech startup that has developed game-changing AI technology for synthetic data. Our solutions enable organizations across the world and across industries to safely share big data assets, internally as well as externally, while keeping the privacy of their customers fully protected. This breakthrough in data protection is made possible by leveraging generative deep neural networks that extract patterns, structures and variations from existing data to generate highly realistic & highly accurate synthetic customers.

Our international team of data enthusiasts takes pride in offering the world's most advanced synthetic data solutions, and thus to enable a big data ecosystem where privacy is truly respected. In order to scale our business to the next level we are seeking to fill several open positions.

Who You Are

You love deep learning, you love research and you love to push the boundaries of what's possible in the domain of unsupervised machine learning. You have worked on AI products in the past and you know what it takes to translate research into production.

If this sounds like you then you should read further!
Responsibilities
Conduct cutting edge research in the field of generative AI
Prototype implementations and support engineering in bringing them into production
Support client projects from end to end incl. data analysis, data processing and client communication
Discover insights, draft reports and summarize findings
Present results to clients and stakeholders
Develop and document best practices and share these internally
Requirements
4+ years of professional data science experience
Expert knowledge in Deep Learning and with Tensorflow
Good knowledge of R and Python, PySpark is a plus
Willingness to learn and constantly improve own data science skills
Strong analytical mindset, curiosity to dig into data and find insights
Highly energetic personality with a “can do / getting things done” attitude
Ability to prioritize and manage multiple tasks simultaneously
Result-driven as well as excellent interpersonal, communication, and collaborative skills
English, German is a plus
Must be able to navigate and blend into a high pace start-up environment
Our Perks
Be part of the revolution and work with international top experts in the field of unsupervised AI
Build the world you wish to see - a future where big data and privacy can co-exist
Live and work in Vienna, named year-after-year the most liveable city in the world!
Benefit from five weeks of paid vacation and 100% covered health insurance here in Austria
Enjoy lunch subsidies and free annual public transportation tickets
Take snacks and drinks at the office, and celebrate happy hours with your colleagues
Join us on team events, ranging from cross country skiing to carpenter workshops - we don't settle for boring
€60.000 annual gross salary incl. overtime – additional payment according to skills and experience

If you love data as much as we do, then come and join us to advance, deploy and promote our category-defining novel solutions around privacy-preserving generative AI.",-1,Mostly AI,Gerasdorf bei Wien,-1,Unknown,-1,-1,-1,Less than $1 million (USD),-1
Data Scientist TensorFlow Python,"Data Scientist Vienna to €70k

Data Scientist / Engineer (TensorFlow Python Machine Learning AI). Would you like to advance your career, remain hands-on and make an impact at a global FinTech whilst enjoying a range of perks including flexible working and training budget?

As a senior Data Scientist / Engineer you will take a lead role in a small team to produce trading strategies using Python, AI and Machine Learning techniques to make sense of data and advise clients on market behaviours.

You'll be based in modern offices in Central Vienna; there's a great team environment with regular social / sports / team events as well as personalised training budget and time set aside each week for your own personal R&D or paid for German language lessons.

Requirements:
You're an experienced Data Scientist / Engineer with strong Python scripting / coding skills
You have a strong knowledge of Machine Learning (including experience with TensorFlow) and Neural Networks
Ideally you will have experience with MongoDB, CI/CD, Docker and Artificial Intelligence
You have a strong record of academic achievement including BSc and MSc - Computer Science, Mathematics or Physics preferred
You have fluent English language skills (German beneficial, or desire to learn)
As a Data Scientist / Engineer you will earn a competitive salary (to €70k) plus bonus and benefits.

Apply now!

Ref: 15286/B/KS/250920",4.4,"Client Server
4.4",Gerasdorf bei Wien,-1,51 to 200 Employees,1999,Business Services,Staffing & Outsourcing,Unknown / Non-Applicable,-1
Senior Data Scientist (f/m/d),"Erste Group IT International (EG IT INT) is the IT service provider of Erste Group, supplying solutions to all entities. It provides development, implementation and integration as well as operation of group-wide solutions. Aimed at offering the best service at the best price, EG IT INT plays a key strategic role within Erste Group.

We are looking for a Senior Data Scientist to analyze large amounts of raw information to find patterns that will help improve our company. We will rely on you to build data products to extract valuable business insights.

In this role, you should be highly analytical with a knack for analysis, math and statistics. Critical thinking and problem-solving skills are essential for interpreting data. We also want to see a passion for data, modeling and algorithms.

Your goal will be to help our company analyze trends to make better decisions.

Your Tasks

You deliver data science assignments and tasks in data driven projects/ programs in which learning from data and getting added value from data insights has a significant part (Innovation, Big Data, Data Science and AI, Data Analytics projects and similar)
You are ready to deliver independently simple and complex tasks and assignments, not only within his specification
You show genuine curiosity and thinking about innovative problem solutions
You collaborate together with our business units to identify and deliver solutions for critical business challenges
You deliver and support in all phases of the full Data Science process, but with different level of expectations and allocation, depending on the concrete project/prototype like business understanding, analytic approach, data requirements and collection, data understanding, modelling and algorithms, evaluation and interpretation, deployment and solution development support and monitoring and tuning support

Your Background

You have a Bachelor’s or Masters degree with a focus on quantitative disciplines

You have a good understanding of common machine learning algorithms and ability to teach junior data scientists across the organization

Your understanding of banking business is good

You are experienced in Data Analytics and Visualization Tooland have knowledge in machine learning areas (NLP, deep learning, etc.)

You gained advanced knowledge in Big Data Ecosystem components (SQOOP, HIVE, IMPALA, OOZIE, KUDU, etc.), and Cloud technologies (MS Azure, AWS)

You have knowledge of Python, R, SPARK, KNIME, etc. and first hand experience in visualization tools like Tableau, QLIK, R Shiny

You are able to handle the full data science lifecycle incl. deployment and operation of analytical models.

Your language skills: English full professional proficiency

Our Offer
We offer an autonomous and diversified position in an experienced team with international experience.
We support your professional and personal development at all times. Our employees appreciate attractive career opportunities, flexible working hours, numerous social benefits and a professional working atmosphere.

A competitive and performance-related salary dependent on your professional and personal qualifications is granted - the minimum wage for this position in accordance with the respective collective agreement is EUR 49.910,- gross per year

Erste Group considers the diversity of its employees as key to innovation and success. As employer we are proud to offer everyone equal chances, irrespective of age, skin colour, religious belief, gender, sexual orientation or origin

Discover and enjoy the benefits of Erste Group

Interested?

We are looking forward to fill the position at the earliest possible date - apply now! #believeinyourself

Degree of Employment: Full-Time

Primary Location: Austria-Vienna",4.2,"Erste Bank der oesterreichischen Sparkassen AG
4.2",Gerasdorf bei Wien,-1,10000+ Employees,1819,Finance,Banks & Credit Unions,$5 to $10 billion (USD),-1
